fukuda,smartking,Test1111,企業ホームページ作成のお仕事,作業中,smartking,今回のプロジェクトについての詳細を共有していただけますか？,当方初めての依頼になります。どのように進めれば良いでしょうか？,提案と見積もりをまとめ、送付いたしました。内容をご確認いただいた後、ご質問や修正の要望があればお知らせください。,提案と見積もり確認しました。ご提案通りに進めてください。,プロジェクトが無事に完了しました。ウェブサイトの最終版を納品に進めてよろしいでしょうか。,-,-,-,-,-,-,-,-,-,-
cool_noriko,blueberry,Test1111,ホームページのロゴ制作の依頼です,作業中,blueberry,発注、ありがとうございます。 プロジェクトの完了までよろしくお願い致します。 さっそく、ご要望につてい詳しくお聞かせください。,"制作についての詳しい要望をまとめました。
ご確認ください。
- ブランドやビジョンに関する説明
- 好みのカラースキームやデザインスタイル
- ロゴに含まれてほしい要素やアイデア
- 予算と納期の指定","ご要望を確認いたしました。
それでは早速作業に入ります。
今回のプロジェクト、迅速に対応していきます。
最後までよろしくお付き合いお願い致します。","お疲れ様です。
作業の進み具合はどんな感じでしょうか、
進行状況の報告をお願いします。",ロゴ制作が完了し、バナー制作に取り掛かりました。,-,-,-,-,-,-,-,-,-,-
maekawa,buleline,Test1111,お部屋探し用の紹介TikTok動画の制作をお願いします,作業中,maekawa,紹介動画を作成してほしい物件のデータと詳しい要望を添付ファイルでお送りします。,"物件データ、詳しいご要望ありがとうございます。
動画制作に取り掛かります。
最後までよろしくお願いいたします。",テストパターンとしてまず1件見せていただけますか？,初期の制作案を提供します。フィードバックをお願いします。,動画の内容は素晴らしいですが、価格情報がもう少し目立つようにならないでしょうか？,-,-,-,-,-,-,-,-,-,-
yousuke_s,gdink_lab,Test1111,御社の経営の健康診断をおまかせください,検収中,gdink_lab,"弊社は新商品の開発と販売戦略の改善に取り組んでいます。具体的な課題や目標は以下の通りです。
- 販売戦略の見直し
- 新商品の競争力強化
- 顧客獲得とリテンションの向上
添付ファイルで弊社のデータを送ります。","いただいた会社データを元に
-販売戦略の分析と改善策の提案
- 新商品の市場調査と競合分析
- 顧客セグメンテーションとカスタマーエクスペリエンス向上の戦略
以上の項目をレポートにまとめました。（添付ファイルをご参照ください）","提案が魅力的ですね。具体的なスケジュールと予算について実際にお会いして詳しく話し合いたいです。
","承知いたしました。
プロジェクトを進行し、貴社のビジョンに向けて共に取り組みましょう。",初回2時間ほどお願いしたいと思います。,-,-,-,-,-,-,-,-,-,-
bestone,fukuda,Test1111,英語翻訳・校正、専門分野対応可です,検収中,bestone,"当方をお選びいただきましてありがとうございます。
早速ですが具体的な文書の長さ、専門用語の有無、納期、および翻訳の目的について教えていただけますか？","約10,000ワードのコンテンツを日本語から英語に翻訳したいと考えています。
文書には特定の業界用語が含まれていますので、専門的な翻訳が必要です。","了解しました。提案を以下に示します。
翻訳に必要な時間（4日間）と料金は10万円で、納期は1週間後です。
",提案してくださった条件で作業を進めてください。,お約束の翻訳物を添付ファイルで提供しました。どうぞご確認ください。,納品ありがとうございます。検収の後お支払いに進めさせていただきます。,-,-,-,-,-,-,-,-,-
aoi_yamamoto,cheers,Test1111,弊社サービスの開発業務をお願いします,検収中,cheers,提案と見積もりをまとめ、送付いたしました。内容をご確認いただいた後、ご質問や修正の要望があればお知らせください,提案と見積もり確認いたしました。質問要望はチャットでお知らせします。,進行状況をお知らせいたします。現在、デザインフェーズに取り組んでおり、予定通り進んでいます。次のステップに進む前に、デザインの確認をお願いいたします,デザインを確認しました。その後のプロジェクトの進行状況についてのアップデートをお願いします。予定通り進んでいますか？,プロジェクトが無事に完了しました。検収が終わりましたら詳細な納品手順をお知らせいたします。,-,-,-,-,-,-,-,-,-,-
blueberry,cool_noriko,Test1111,視認性の高い【チラシ・フライヤー】を制作します,検収中,blueberry,"初期のデザイン案を以下に示します。
パターンは3種類用意しました。
フィードバックをお願いします。",デザインの色合いが素晴らしいですが、製品の詳細をもう少し強調できる方法があれば教えていただけますか？,色合いを変えた修正版のデザインを提供しました。どうぞご確認ください。,修正版が素晴らしいです。このデザインで進めていただけますか？,作業が完了しました。ファイナルデザインを提供して、ファイルを納品します。,-,-,-,-,-,-,-,-,-,-
cool_noriko,knaoya,Test1111,ブライダル記録・収録撮影のお仕事依頼,検収完了,knaoya,"わたしどもに発注していただきましてありがとうございました。
ビデオ撮影のお手伝いをさせていただけることを嬉しく思います。日程と何時から何時までの撮影かをお知らせください。",撮影は今月15日、午前10時から夕方の5時までを希望しています。また、披露宴のパーティーも含めた撮影をお願いしたいです。長い撮影になりますが最後までよろしくお願い致します。,日程と時間、承知致しました。披露宴も含めますので、大切な瞬間をしっかりと捉えます。場所や特別なショットのリクエストはございますでしょうか？,場所は教会での式とその後のレセプション会場です。特別なショットとして、誓いの言葉を交わすシーンやケーキカット、ファーストダンスなどを重点的に撮影してほしいです。,確認しました、大切な瞬間を重点的に撮影いたします。また、カメラマンは何人必要かお知らせいただけますか？,カメラマンは2人でお願いします。式場と会場を同時に撮影してほしいので、2人が必要です。,2人のカメラマンを手配しますので、シーンを同時に撮影できます。最終的な編集や納期についてもお話ししましょう。どのくらいの期間で編集が必要ですか？,編集には2週間ほどかかっても問題ありません。納期は1か月後に設定してください。,納期を1か月後に設定し、2週間以内に編集を完了いたします。詳細を確認し、お手伝いできることを楽しみにしています。,無事に撮影出来たとの事でありがとございました。編集を楽しみにしております。,編集が完了しテロップ、音楽追加などの作業も完了いたしました。ご指定のフォーマットで納品いたします。,"結婚式の撮影を担当していただき、本当に素晴らしいサービスを提供していただきました。式やパーティーの特別な瞬間を見逃さずに捉えていただき、感動的な瞬間を永遠に残すお手伝いをしていただきました。

カメラマンのプロフェッショナリズムと対応の質は素晴らしくリラックスした雰囲気を作り出してくれました。特に誓いの言葉を交わすシーンやファーストダンスの撮影は非常に印象的でした。

編集も期待以上で感動的なビデオを仕上げていただきました。納期も守っていただき、感謝の気持ちでいっぱいです。

ありがとうございました。",3,,3
ken_kimura,pro_works,Test1111,募集！UI/UXエンジニア・データベースエンジニア,作業中,pro_works,"この度は弊社を選定してくださり御礼申し上げます。
具体的な要件や機能、予算、納期、およびデータベースの規模について詳しく教えていただけますか？","今回のプロジェクト、完了までよろしくお付き合いください。
ますはスクレイピングしていただきたい不動産サイトのHTMLを提供いたしますので、ご確認ください。
","資料ありがとうございます。
いただいた資料を元にプロジェクトを開始しました。
進捗状況を定期的に共有し、問題が発生した場合にはすぐに対応いたします。","一部のデータの取り込み方法に関して質問があります。
ビデオ会議は可能でしょうか？",はい、このサイトのビデオ会議機能が利用できます。,-,-,-,-,-,-,-,-,-,-
sasaki7,aoi_yamamoto,Test1111,テープ起こし、文字起こし、おまかせください,検収完了,sasaki7,文字起こし作業が終わりました。スピーカーごとに分けて正確にテキストにしていると思います。検収よろしくお願い致します。,できるだけ正確にテキスト化してほしいです。スピーカーごとに区切っていただけると読みやすくなります。,提供していただいた音声ファイルで作業可能です。早速作業にかからせていただきます。ある程度のお時間をいただきます。しばらくお待ちください。,弊社主催のオンライン座談会の音源を提供致します。音声ファイルのフォーマットのご指定などありましたらお申し付けください。よろしくお願いいたします。,aoi_yamamotoさま、わたしどもを選定していただきありがとうございます。最後まで気持ちよくプロジェクトを進められるよう努力してまいります。早速ですが資料の提供をお願い致します。,-,-,-,-,-,-,"今回、座談会の音源からの文字起こしを依頼されましたが依頼主は非常にコミュニケーションが取りやすくプロフェッショナルな姿勢でプロジェクトを進行していただきました。

的確な指示と迅速な対応に感銘を受けました。
プロジェクトに関する質問や特別な要望にも柔軟に対応していただき信頼性の高い取引パートナーとしての印象を強く受けました。

今後もお取引を継続していきたいと思っており再び協力できることを楽しみにしています。ありがとうございました。",3,"文字起こしの作業を依頼しましたが仕事の質と速さに非常に満足しています。
素早い対応と正確な文字起こしに感銘を受けました。
コミュニケーションも円滑でプロジェクトに関する疑問や特別なリクエストにも迅速に対応していただきました。

専門知識とプロフェッショナリズムが感じられ今後も何か文字起こしの作業があればぜひ再度お願いしたいと思っています。
高品質なサービスを提供していただき本当にありがとうございました。",3
fukuda,smartking,Test1111,住宅産業メーカーサイトのデザイン改修,検収完了,smartking,当社をお選びいただき感謝します。私たちはこのプロジェクトに対して熱意を持ち、最高の成果を提供することを約束いたします。,"こちらこそよろしくお願いします。
このプロジェクト、最後まで気持ちよくやり取りが出来る事を期待しております。
まずはこれからの進め方を提示していただけますか？","プロジェクトの進行について

今後の進行に関して、以下のステップを検討しております：

プロジェクトキックオフミーティング: まず、プロジェクトの詳細と要件についてのキックオフミーティングを設定いたします。ここでのディスカッションを通じてプロジェクトの方向性や目標を明確にし、共通の理解を深めます。

デザインコンセプト提案: プロジェクトのビジュアルデザインに関して、コンセプト提案をご提供いたします。ご意見やフィードバックを伺いながら、理想的なデザインを具現化していきます。

デザインの調整: コンセプトが確立された後、デザインを詳細に仕上げていきます。カラーコンセプト、フォント、画像、レイアウトなど、すべてを最適化し、ご満足いただけるデザインを目指します。

開発とテスト: デザインが確定したら、ウェブサイトの開発に取り組み、品質を確保するためのテストを実施します。機能の正確性とブラウジング体験の向上を重視します。

最終納品: テストと最終調整が完了したら、プロジェクトを納品いたします。ウェブサイトが公開され、お客様のビジョンが実現される瞬間です。

ご質問や要望がございましたら、いつでもお知らせください。プロジェクトの進行について透明性を持ち、協力し合いながら最高の結果を追求していきます",プロジェクト進行のご提示ありがとうございます。さらに詳しい事はチャットルームで打ち合わせをしていきたいとおもいます。このサイトのチャットルームへ移動しましょう。,チャットルームによる詳細な打ち合わせでここまでプロジェクトを進める事が出来ました。納品物をご確認ください。ありがとうございました。,-,-,-,-,-,-,"プロジェクトに対して熱心でクライアントの要件に応じた魅力的なデザインを提供していただきました。さらにタイムリーかつ効果的なコミュニケーションを通じて進行状況や提案の変更点について常に誠実に対応していただきました。

最終的な成果物は私たちの期待を上回るものでありクオリティとアピールが満載のウェブサイトができあがりました。制作者のプロフェッショナリズムとコミットメントに心から感謝しています。

今後のプロジェクトでもぜひ再度協力したいと考えています。お世話になり本当にありがとうございました。",3,"このプロジェクトを通じて御社のプロジェクトへの熱意に深く感銘を受けました。明確なビジョンと的確なフィードバックがプロジェクトを成功に導く鍵でした。

プロジェクトの初めから終わりまで常にタイムリーかつ詳細な指示を提供していただきプロジェクトの進行をスムーズにしました。御社のクリエイティブなアイデアと柔軟性に感謝しています。

また、何か新しいプロジェクトやアイデアが浮かびましたらいつでもお知らせください。ありがとうございました。",3
aoi_yamamoto,cheers,Test1111,多数のプロジェクトに対応できるフロントエンドディベロッパー募集中！,検収完了,cheers,選定していただき御礼申し上げます。長期のプロジェクトという事で末長くよろしくお願い致します。一般的なHTMLコーディングの他ワードプレスによるサイト構築も得意としております。,こちらこそよろしくお願い致します。このところ案件数が急増していましてフロントエンドコーディングのエキスパート様にぜひご参加願いたいと思っておりました。,具体的な報酬、稼働時間についてお打ち合わせをお願いします。チャットルームでの打ち合わせでよろしいでしょうか？,了解しました。チャットルームへ参りましょう。,チャットルームでの具体的な報酬・稼働時間などのご提示ありがとうございました。採用していただけるなら次のステップ（契約完了）へ進めてください。,-,-,-,-,-,-,"cheers様の手腕によりデザインからコーディングへのスムーズな移行が可能となりプロジェクトの成功に大いに貢献していただけると確信しました。
コミュニケーションも非常に円滑で提案や変更点に対して素早く対応していただけたようで非常に感謝しています。",4,"チャットでの打ち合わせでは緊張せずに自分の意見や考えを述べることができる雰囲気を作っていただきました。
そのおかげで自信を持って質問することが出来、それに対するフィードバックも的確でした。
一緒にお仕事が出来るのが楽しみになりました。ありがとうございました。",3
gdink_lab,fukuda,Test1111,当社サイトのランディングページ制作をお願いします。,検収完了,gdink_lab,こんにちは、弊社はアロマオイルやスキンケア製品を専門に製造しています。最新の製品ラインを効果的に宣伝し、オンライン販売を促進するランディングページを作成したいと考えています。,"今回は弊社を選定していただきまして感謝いたします。
アロマテラピー製品のランディングページ制作に関してお手伝いできることを嬉しく思います。具体的にどの製品を宣伝し、どのような目標を持っていますか？",現在、新しいラインのオーガニックアロマオイルとフローラルウォーターを強調したいと思っています。また、オーガニック製品へのこだわりや製品の効果についても伝えたいです。,"了解しました。
55000円の予算で3週間以内にランディングページを制作いたします。
製品写真と情報の充実を考慮に入れ魅力的なデザインと効果的なコンテンツを組み合わせます。
それでは作業に入ります。","本当に魅力的なデザインのランディングページが出来上がったと思います。
納品物の検収後にお支払いを致します。
今回のプロジェクト、ありがとうございました。",-,-,-,-,-,-,"fukuda様のおかげでプロジェクトを無事に完了できて大変満足しています。専門知識とクリエイティブなデザイン能力に感銘を受けました。プロジェクトに取り組む姿勢も素晴らしく、納期を守りつつ高品質なランディングページを提供していただきました。

特に製品の特徴を見事に表現し効果的なコンテンツを提供していただいたことに感謝しています。おかげで製品の魅力を効果的に伝えオンライン販売に大いに貢献出来ます。

コミュニケーションもスムーズで要望や変更に対する対応が迅速でした。協力してプロジェクトを成功に導いていただき本当にありがとうございました。",4,"gdink_lab様とのプロジェクトは非常に協力的でスムーズなコミュニケーションができました。プロジェクトの要件や目標に対する明確な説明とフィードバックはプロジェクトを円滑に進めるのに大いに役立ちました。

gdink_lab様はデザインに対するビジョンが明確でありそのビジョンを実現するお手伝いができて光栄でした。また柔軟性を持ちながらも品質を重視されプロジェクト全体において最高の成果を追求されました。

今回のプロジェクトに参加させていただきありがとうございました。",4
aoi_yamamoto,cheers,Test1111,エステサイトをワードプレスで制作してください,検収完了,aoi_yamamoto,"今回のプロジェクト、よろしくお願いします。
具体的な作業内容はデザインとコーディング（レスポンシブ対応）で、ページ数は固定ページが6〜7ページ、下層ページが5〜6ページ程度となります。","作業内容了解いたしました。サーバーの用意、ワードプレスの構築などはどうなっていますか。
こちらにお任せいただいても大丈夫ですが。","サーバーの用意、ワードプレスの構築はこちらで済ませています。サイトマップも弊社で既に作成済みですので、ワードプレスへのログイン後、すぐに制作を開始いただけます。
サーバー情報・ログイン情報など提供いたします。","サーバー情報・ログイン情報ありがとうございます。作業に取り掛かります。
デザインが出来ましたら提供いたしますのでご確認ください。
",提供していただいたデザインで良いと思います。コーディングへ進めてください。,作業が完了しましたので納品します。検収をお願い致します。,-,-,-,-,-,"今回のサイト制作のプロジェクトにおいて期待した結果を得ることができませんでした。
コミュニケーションや理解に誤解が生じ望んだ成果を得ることが難しかったです。ただしcheers様の努力と尽力は認めます。
今後はより明確なコミュニケーションと共通のビジョンを築くことが重要だと思いました。",1,"aoi_yamamoto様との協力においてコミュニケーションと理解に誤解が多くプロジェクトの進行が複雑化しました。
要望や方針が不明確でaoi_yamamoto様のイメージを掴むのが難しかったです。
今後のプロジェクトにおいてはより明確な指示とイメージの共有が必要だと感じました。",1
dai_maek,blueberry,Test1111,医療機器企業のwebサイトのバナー作成依頼,検収完了,blueberry,"ご依頼ありがとうございます。
今回のプロジェクト、最後までよろしくお願いいたします。
最大2回の修正・調整は無料で対応致します。
プロジェクト完了までの予定納期：4日間を予定しております。
","こちらこそよろしくお願いします。
キャッチコピーとテキスト、画像素材、特別な要望をまとめた資料を提供いたします。
医療機器の専門的な用語は正確にお願いします。","資料のご提供ありがとうございます。
医療機器の専門的な用語についてわからない部分は質問させていただきます。
それでは作業に取り掛かります。完了までお付き合いよろしくお願い致します","途中経過を拝見しましたが専門的な用語の使い方が間違っています。
修正ポイントをまとめたものを提供いたしますのでご確認ください。","修正ポイントのご提供ありがとうございます。
専門的な用語に気をつけて修正したものを納品します。
検収をお願いします。",検収が完了しました。契約ステイタスを完了へ進めさせていただきます。,-,-,-,-,-,"今回のような専門的な用語が重要な制作のプロジェクトにおいて、正確な表現が重要でした。
Blueberry様とはコミュニケーションや理解に誤解が生じ望んだ成果を得ることが出来ませんでした。",1,"専門的な用語の使い方に誤解が多くプロジェクトの進行が複雑化しました。
dai_maek様の要望や方針が不明確で制作に反映するのが難しかったです。
今後のプロジェクトにおいてはより明確なコミュニケーションと情報の共有に注意をしたいと思います。",1
